{
  "slug": "origin",
  "name": "Soveris Origin",
  "hero": {
    "title": "Own your focus",
    "subtitle": "Private focus tracking on your device.",
    "cta": {
      "label": "Get started",
      "href": "/download"
    },
    "backgroundImage": {
      "src": "/images/origin-hero.webp",
      "alt": "Soveris Origin dashboard"
    }
  },
  "form": {
    "title": "Tell us what you need",
    "submitLabel": "Send",
    "schema": {
      "type": "object",
      "properties": {
        "notes": {
          "type": "string",
          "title": "Notes",
          "order": 1,
          "maxLength": 2000,
          "ui:widget": "textarea"
        },
        "contactAddress": {
          "type": "string",
          "format": "email",
          "title": "Email address",
          "order": 2,
          "maxLength": 254
        }
      },
      "required": [
        "notes",
        "contactAddress"
      ],
      "additionalProperties": false
    }
  }
}
