{
  "slug": "origin",
  "name": "Origin",
  "hero": {
    "title": "Soveris Origin",
    "subtitle": "100% local focus tracking",
    "cta": {
      "label": "Join the Origin waitlist",
      "href": "/signup"
    },
    "secondaryCta": {
      "label": "Read the principles",
      "href": "#principles"
    },
    "backgroundImage": {
      "src": "/images/origin/hero.png",
      "alt": "Origin product dashboard"
    },
    "trustText": "Every insight is generated and stored exclusively on your device. No cloud. No exceptions."
  },
  "features": {
    "heading": "Built on principles that matter",
    "description": "Every promise we make is kept on your machine.",
    "items": [
      {
        "title": "100% local",
        "description": "Everything runs on your device, always",
        "image": {
          "src": "/images/origin/feature-local.png",
          "alt": "Local-first architecture"
        }
      },
      {
        "title": "On-device AI",
        "description": "Intelligence that never needs the internet",
        "image": {
          "src": "/images/origin/feature-on-device.png",
          "alt": "On-device AI"
        }
      },
      {
        "title": "Zero cloud",
        "description": "No servers. No exceptions. No compromise"
      }
    ]
  },
  "questions": {
    "heading": "Frequently asked questions",
    "description": "Everything you need to know before getting started.",
    "items": [
      {
        "question": "Is my data really private?",
        "answer": "Completely. Every insight Origin generates stays on your device."
      },
      {
        "question": "Does Origin need internet?",
        "answer": "No. Origin runs entirely offline on your device."
      }
    ]
  },
  "form": {
    "title": "Join the Soveris Origin beta",
    "description": "Tell us how you protect your focus.",
    "submitLabel": "Join the waitlist",
    "schema": {
      "type": "object",
      "properties": {
        "contactAddress": {
          "type": "string",
          "format": "email",
          "title": "Field 0",
          "order": 1,
          "maxLength": 500
        },
        "field1": {
          "type": "string",
          "title": "Field 1",
          "order": 2,
          "maxLength": 500
        },
        "field2": {
          "type": "string",
          "title": "Field 2",
          "order": 3,
          "maxLength": 500
        },
        "field3": {
          "type": "string",
          "title": "Field 3",
          "order": 4,
          "maxLength": 500
        },
        "field4": {
          "type": "string",
          "title": "Field 4",
          "order": 5,
          "maxLength": 500
        },
        "field5": {
          "type": "string",
          "title": "Field 5",
          "order": 6,
          "maxLength": 500
        },
        "field6": {
          "type": "string",
          "title": "Field 6",
          "order": 7,
          "maxLength": 500
        },
        "field7": {
          "type": "string",
          "title": "Field 7",
          "order": 8,
          "maxLength": 500
        },
        "field8": {
          "type": "string",
          "title": "Field 8",
          "order": 9,
          "maxLength": 500
        },
        "field9": {
          "type": "string",
          "title": "Field 9",
          "order": 10,
          "maxLength": 500
        },
        "field10": {
          "type": "string",
          "title": "Field 10",
          "order": 11,
          "maxLength": 500
        },
        "field11": {
          "type": "string",
          "title": "Field 11",
          "order": 12,
          "maxLength": 500
        },
        "field12": {
          "type": "string",
          "title": "Field 12",
          "order": 13,
          "maxLength": 500
        },
        "field13": {
          "type": "string",
          "title": "Field 13",
          "order": 14,
          "maxLength": 500
        },
        "field14": {
          "type": "string",
          "title": "Field 14",
          "order": 15,
          "maxLength": 500
        },
        "field15": {
          "type": "string",
          "title": "Field 15",
          "order": 16,
          "maxLength": 500
        },
        "field16": {
          "type": "string",
          "title": "Field 16",
          "order": 17,
          "maxLength": 500
        },
        "field17": {
          "type": "string",
          "title": "Field 17",
          "order": 18,
          "maxLength": 500
        },
        "field18": {
          "type": "string",
          "title": "Field 18",
          "order": 19,
          "maxLength": 500
        },
        "field19": {
          "type": "string",
          "title": "Field 19",
          "order": 20,
          "maxLength": 500
        }
      },
      "required": [
        "contactAddress",
        "field1",
        "field2",
        "field3",
        "field4",
        "field5",
        "field6",
        "field7",
        "field8",
        "field9",
        "field10",
        "field11",
        "field12",
        "field13",
        "field14",
        "field15",
        "field16",
        "field17",
        "field18",
        "field19"
      ],
      "additionalProperties": false
    }
  },
  "footer": [
    {
      "heading": "Product",
      "links": [
        {
          "name": "Download",
          "href": "/download"
        },
        {
          "name": "Principles",
          "href": "#principles"
        }
      ]
    },
    {
      "heading": "Legal",
      "links": [
        {
          "name": "Privacy",
          "href": "/privacy"
        },
        {
          "name": "Terms",
          "href": "/terms"
        }
      ]
    }
  ],
  "seo": {
    "metaTitle": "Soveris Origin — private focus tracking",
    "metaDescription": "Own your attention with private, local-first focus tracking."
  }
}
