{
  "slug": "origin",
  "name": "Soveris Origin",
  "hero": {
    "title": "Own your focus",
    "subtitle": "Private focus tracking on your device.",
    "cta": {
      "label": "Get started",
      "href": "/download"
    },
    "backgroundImage": {
      "src": "/images/origin-hero.webp",
      "alt": "Soveris Origin dashboard"
    }
  },
  "form": {
    "title": "Tell us what you need",
    "submitLabel": "Send",
    "schema": {
      "type": "object",
      "properties": {
        "faaaaaaaaaaaaaaaaaaaaaaaaaaaaaaaaaaaaaaaaaaaaaaaaaaaaaaaaaaaaaaa": {
          "type": "string",
          "title": "Field",
          "order": 1,
          "maxLength": 500
        },
        "contactAddress": {
          "type": "string",
          "format": "email",
          "title": "Email address",
          "order": 2,
          "maxLength": 254
        }
      },
      "required": [
        "faaaaaaaaaaaaaaaaaaaaaaaaaaaaaaaaaaaaaaaaaaaaaaaaaaaaaaaaaaaaaaa",
        "contactAddress"
      ],
      "additionalProperties": false
    }
  }
}
